{
  "id": "starters_lesson_002",
  "level": "starters",
  "topic_id": "topic_in_class",
  "order": 2,
  "title": "Learning in the classroom",
  "scenario": "You are in a teacher role. Use English naturally in this in class situation.",
  "estimated_minutes": 4,
  "dialogue": {
    "setting": "Classroom, Tuesday morning",
    "characters": [
      {
        "id": "char_a",
        "name": "Mr. Duc",
        "role": "teacher"
      },
      {
        "id": "char_b",
        "name": "Lan",
        "role": "student"
      }
    ],
    "lines": [
      {
        "character_id": "char_a",
        "text": "Stand up, class! Good morning!"
      },
      {
        "character_id": "char_b",
        "text": "Good morning, teacher!"
      },
      {
        "character_id": "char_a",
        "text": "Sit down. Look at the board."
      },
      {
        "character_id": "char_b",
        "text": "Yes, teacher. We are looking."
      },
      {
        "character_id": "char_a",
        "text": "Good. Listen to me, please."
      }
    ]
  },
  "vocabulary_ids": [
    "starters_vocab_004",
    "starters_vocab_005",
    "starters_vocab_006",
    "starters_vocab_007",
    "starters_vocab_014",
    "starters_vocab_015",
    "starters_vocab_016",
    "starters_vocab_017",
    "starters_vocab_018",
    "starters_vocab_019",
    "starters_vocab_020",
    "starters_vocab_021",
    "starters_vocab_022",
    "starters_vocab_023"
  ],
  "grammar_ids": [
    "starters_grammar_001",
    "starters_grammar_003"
  ],
  "exercises": [
    {
      "type": "match",
      "instruction": "Match the picture with the correct word.",
      "items": [
        {
          "image_hint": "an open English textbook on a desk",
          "correct_answer": "book"
        },
        {
          "image_hint": "a blue ink pen lying on a notebook",
          "correct_answer": "pen"
        },
        {
          "image_hint": "a female teacher smiling at the front of a class",
          "correct_answer": "teacher"
        }
      ]
    },
    {
      "type": "arrange",
      "instruction": "Put the words in the correct order.",
      "items": [
        {
          "words": [
            "your",
            ".",
            "Open",
            "book"
          ],
          "correct_answer": "Open your book."
        },
        {
          "words": [
            "Look",
            ".",
            "the",
            "board",
            "at"
          ],
          "correct_answer": "Look at the board."
        },
        {
          "words": [
            ",",
            "please",
            "me",
            "to",
            ".",
            "Listen"
          ],
          "correct_answer": "Listen to me, please."
        }
      ]
    },
    {
      "type": "listen_choose",
      "instruction": "Listen and choose the correct sentence.",
      "items": [
        {
          "audio_text": "Open your book.",
          "options": [
            "Open your book.",
            "Look at the board.",
            "Listen to me, please."
          ],
          "correct_answer": "Open your book."
        },
        {
          "audio_text": "Look at the board.",
          "options": [
            "Look at the board.",
            "Listen to me, please.",
            "Open your book."
          ],
          "correct_answer": "Look at the board."
        },
        {
          "audio_text": "Listen to me, please.",
          "options": [
            "Listen to me, please.",
            "Look at the board.",
            "Open your book."
          ],
          "correct_answer": "Listen to me, please."
        }
      ]
    },
    {
      "type": "fill_blank",
      "instruction": "Fill in the missing word.",
      "items": [
        {
          "prompt": "___ your book.",
          "correct_answer": "Open"
        },
        {
          "prompt": "___ at the board.",
          "correct_answer": "Look"
        },
        {
          "prompt": "___ to me, please.",
          "correct_answer": "Listen"
        }
      ]
    },
    {
      "type": "multiple_choice",
      "instruction": "Choose the best answer.",
      "items": [
        {
          "prompt": "Look at the picture (an open English textbook on a desk). What is this?",
          "options": [
            "teacher",
            "book",
            "pen"
          ],
          "correct_answer": "book"
        },
        {
          "prompt": "Look at the picture (a blue ink pen lying on a notebook). What is this?",
          "options": [
            "pen",
            "book",
            "teacher"
          ],
          "correct_answer": "pen"
        },
        {
          "prompt": "Look at the picture (a female teacher smiling at the front of a class). What is this?",
          "options": [
            "teacher",
            "pen",
            "book"
          ],
          "correct_answer": "teacher"
        }
      ]
    }
  ],
  "ai_conversation": {
    "role": "student",
    "scenario": "Ask questions during class about the lesson.",
    "opening_line": "Teacher, can you help me? I don't understand the task.",
    "level_constraints": {
      "max_sentence_length": 6,
      "allowed_grammar": [
        "starters_grammar_001",
        "starters_grammar_003"
      ],
      "target_vocabulary": [
        "starters_vocab_004",
        "starters_vocab_005",
        "starters_vocab_006"
      ]
    },
    "success_criteria": "Learner explains the task clearly using simple English."
  }
}