{
  "id": "movers_lesson_010",
  "level": "movers",
  "topic_id": "topic_phone",
  "order": 10,
  "title": "Making a phone call",
  "scenario": "You are in a caller role. Use English naturally in this phone situation.",
  "estimated_minutes": 6,
  "dialogue": {
    "setting": "Office, on the phone, Friday afternoon",
    "characters": [
      {
        "id": "char_a",
        "name": "Ms. Hoa",
        "role": "caller"
      },
      {
        "id": "char_b",
        "name": "Partner",
        "role": "receiver"
      }
    ],
    "lines": [
      {
        "character_id": "char_a",
        "text": "Hello, this is Mr. Minh. Can I speak to the principal?"
      },
      {
        "character_id": "char_b",
        "text": "Sorry, the principal is busy right now."
      },
      {
        "character_id": "char_a",
        "text": "Can I leave a message, please?"
      },
      {
        "character_id": "char_b",
        "text": "Of course. What is the message?"
      },
      {
        "character_id": "char_a",
        "text": "Please tell her to call me about Friday's meeting."
      },
      {
        "character_id": "char_b",
        "text": "I will pass on the message. Goodbye!"
      }
    ]
  },
  "vocabulary_ids": [
    "movers_vocab_010",
    "movers_vocab_013",
    "movers_vocab_077",
    "movers_vocab_078",
    "movers_vocab_130",
    "movers_vocab_131",
    "movers_vocab_132",
    "movers_vocab_133",
    "movers_vocab_134",
    "movers_vocab_135",
    "movers_vocab_136",
    "movers_vocab_137",
    "movers_vocab_138",
    "movers_vocab_139",
    "movers_vocab_140",
    "movers_vocab_141",
    "movers_vocab_142",
    "movers_vocab_143"
  ],
  "grammar_ids": [
    "movers_grammar_005"
  ],
  "exercises": [
    {
      "type": "match",
      "instruction": "Match the picture with the correct word.",
      "items": [
        {
          "image_hint": "a modern ringing smartphone vibrating on a table",
          "correct_answer": "phone"
        },
        {
          "image_hint": "a simple, clear colorful visualization of urgent",
          "correct_answer": "urgent"
        },
        {
          "image_hint": "a phone screen showing a busy tone symbol",
          "correct_answer": "busy"
        }
      ]
    },
    {
      "type": "arrange",
      "instruction": "Put the words in the correct order.",
      "items": [
        {
          "words": [
            "want",
            "I",
            "buy",
            "fruit",
            "to",
            "."
          ],
          "correct_answer": "I want to buy fruit."
        },
        {
          "words": [
            ",",
            ".",
            "chicken",
            "order",
            "to",
            "want",
            "please",
            "I"
          ],
          "correct_answer": "I want to order chicken, please."
        },
        {
          "words": [
            "student",
            "ask",
            ".",
            "The",
            "to",
            "question",
            "a",
            "wants"
          ],
          "correct_answer": "The student wants to ask a question."
        }
      ]
    },
    {
      "type": "listen_choose",
      "instruction": "Listen and choose the correct sentence.",
      "items": [
        {
          "audio_text": "I want to buy fruit.",
          "options": [
            "I want to buy fruit.",
            "I want to order chicken, please.",
            "The student wants to ask a question."
          ],
          "correct_answer": "I want to buy fruit."
        },
        {
          "audio_text": "I want to order chicken, please.",
          "options": [
            "I want to buy fruit.",
            "The student wants to ask a question.",
            "I want to order chicken, please."
          ],
          "correct_answer": "I want to order chicken, please."
        },
        {
          "audio_text": "The student wants to ask a question.",
          "options": [
            "The student wants to ask a question.",
            "I want to buy fruit.",
            "I want to order chicken, please."
          ],
          "correct_answer": "The student wants to ask a question."
        }
      ]
    },
    {
      "type": "fill_blank",
      "instruction": "Fill in the missing word.",
      "items": [
        {
          "prompt": "I ___ to buy fruit.",
          "correct_answer": "want"
        },
        {
          "prompt": "I ___ to order chicken, please.",
          "correct_answer": "want"
        },
        {
          "prompt": "The student ___ to ask a question.",
          "correct_answer": "wants"
        }
      ]
    },
    {
      "type": "multiple_choice",
      "instruction": "Choose the best answer.",
      "items": [
        {
          "prompt": "What is this?",
          "options": [
            "phone",
            "urgent",
            "busy"
          ],
          "correct_answer": "phone",
          "image_hint": "a modern ringing smartphone vibrating on a table"
        },
        {
          "prompt": "What is this?",
          "options": [
            "urgent",
            "busy",
            "phone"
          ],
          "correct_answer": "urgent",
          "image_hint": "a simple, clear colorful visualization of urgent"
        },
        {
          "prompt": "What is this?",
          "options": [
            "busy",
            "phone",
            "urgent"
          ],
          "correct_answer": "busy",
          "image_hint": "a phone screen showing a busy tone symbol"
        }
      ]
    }
  ],
  "ai_conversation": {
    "role": "colleague",
    "scenario": "Coordinate plans over the phone.",
    "opening_line": "Hello! This is Minh calling. Can we confirm the schedule?",
    "level_constraints": {
      "max_sentence_length": 8,
      "allowed_grammar": [
        "movers_grammar_005"
      ],
      "target_vocabulary": [
        "movers_vocab_010",
        "movers_vocab_013",
        "movers_vocab_077"
      ]
    },
    "success_criteria": "Learner coordinates plans and leaves a phone message successfully."
  }
}